cluster_id,cluster_name,track,us_share,content_layer,business_role,primary_entity,jtbd,content_angle,pillar_page,keywords_included,cta_primary,psych_safety_flag,priority,week
aura_colors_1a,Aura Colors & Meanings,量产线,高,Wiki,Topic Authority,Aura Colors,Identify aura color meanings,"Scientific explanation + Spiritual meaning",How to Read Aura Colors,"aura reading, what color is your aura, purple aura meaning, white aura meaning, green aura meaning, orange aura meaning, red aura meaning",aura test,N,P0,Week 1
houses_life_areas,Astrology Houses as Life Areas,精修线,高,Core,Differentiation,Astrology Houses,Self-discovery through birth chart houses,Psychological reflection on life areas,The 12 Houses: Your Life Map,"8th house, 9th house, 11th house, 12th house, what does the 8th house represent, 8th house meaning",birth chart calculator,N,P0,Week 1
lunar_nodes_path,Lunar Nodes & Life Purpose,精修线,高,Core,Differentiation,North & South Nodes,Finding life path and karma,Karmic astrology and soul mission,North Node vs South Node: Your Soul's Compass,"north node, south node, north node meaning, north node in scorpio, north node in taurus, true node vs north node",birth chart calculator,N,P1,Week 2
vedic_astrology_basics,Vedic Astrology Basics,量产线,中,Wiki,Topic Authority,Vedic Astrology,Understand Indian astrology basics,Introduction to Jyotish,Vedic vs Western Astrology: Which is for You?,"vedic astrology, vedic birth chart, vedic astrology birth chart calculator, jyotish astrology",birth chart calculator,N,P1,Week 2
nakshatras_27_stars,Nakshatras (27 lunar mansions),量产线,低,Wiki,Traffic,Nakshatras,Deep dive into moon signs,The 27 Nakshatras and their secrets,Ultimate Guide to 27 Nakshatras,"nakshatra, ashlesha nakshatra, rohini nakshatra, pushya nakshatra, bharani nakshatra",birth chart calculator,N,P2,Week 3
chakra_healing_basics,Chakras & Energy Healing,量产线,高,Wiki,Support,Chakras,Energy balance and healing,Modern guide to chakra system,The 7 Chakras: A Beginner's Guide,"chakra test, crown chakra meaning, solar plexus chakra affirmations, crystals for each chakra",chakra test,N,P1,Week 2
healing_placements,Healing Placements (Chiron & 12th House),精修线,高,Core,Differentiation,Chiron / 12th House,Inner wound healing,Compassionate reflection on inner wounds,Healing Your Inner Wound: Chiron & The 12th House,"chiron in 12th house, mars in 12th house, cancer in 12th house",newsletter,Y,P1,Week 2
astrology_basics_terms,Astrology Basics & Terms,量产线,高,Wiki,Topic Authority,Astrology Terms,General astrology knowledge,Wiki-style definitions,The A-Z of Astrology Terms,"sextile astrology, square astrology, trine in astrology, descendant astrology, ic in astrology",birth chart calculator,N,P2,Week 3
