Target Keyword,Associated Keywords,月搜索量,KD,Intent,Tier,Template,Entity,Friction,Logic,CTA,GSC Keywords,Status,URL,Last Audit,page_id,cluster_id,page_role,content_angle,psych_safety_flag,journal_prompts,target_keyword_zh,author
vozinha birth chart,"vozinha astrology, vozinha zodiac sign, cape verde goalkeeper astrology, vozinha gemini, vozinha world cup 2026",趋势词,0,Info,T2,Case Study,Gemini Sun / Uranus Opposition / Saturn Midlife Transit,球迷看到一个40岁门将在世界杯首秀扑出西班牙7球，想知道为什么这件事发生在他40岁而不是更早——是命运安排还是偶然？,Vozinha 双子座太阳（1986年6月3日生）解释了他的反应速度与场上阅读能力；40岁正是天王星对冲窗口——人生中压抑最久的潜力在此爆发。他差点在世界杯前放弃又创造历史，正是天王星突破的经典叙事。注：无出生时间，仅做太阳星座+过境分析，文中注明birth time unknown。,星盘页,,待写,/en/wiki/vozinha-birth-chart-astrology,,PG-TREND-001,worldcup_2026_astrology,Trend,Vozinha's Gemini Sun and Uranus Opposition: Why His World Cup Moment Was Written for Age 40,N,,沃季尼亚星盘,Marcus Orion
germany world cup players birth chart 2026,"jamal musiala birth chart, florian wirtz zodiac sign, joshua kimmich astrology, musiala pisces, wirtz taurus, kimmich aquarius",趋势词,0,Info,T2,Case Study,Pisces Sun (Musiala) / Taurus Sun (Wirtz) / Aquarius Sun (Kimmich) / Aries Sun (Neuer),球迷看到三代球员（1995年的Kimmich、2003年的Musiala和Wirtz）在场上默契无间，想理解这种化学反应从何而来。,水瓶座队长Kimmich提供战术框架；双鱼座Musiala带来直觉流动性；金牛座Wirtz以韧性和技术稳定性落地——三者构成风为骨、水为魂、土为根的完整结构。彩蛋：Neuer（白羊座，1986年3月27日）同样40岁，与Vozinha同处天王星对冲窗口，两位40岁门将同届创造历史。注：所有球员无出生时间，仅做太阳星座分析。,星盘页,,待写,/en/wiki/germany-world-cup-2026-players-birth-charts,,PG-TREND-002,worldcup_2026_astrology,Trend,Aquarius Leads Pisces Flows Taurus Grounds: The Astrology Behind Germany's 2026 World Cup Stars,N,,德国世界杯球员星盘,Marcus Orion
germany world cup 2026 astrology team,"germany football team zodiac signs, germany 7-1 curacao astrology, germany world cup squad astrology, germany squad star signs 2026",趋势词,0,Info,T2,Case Study,Team Element Distribution / Generational Planets / Saturn in Gemini Generation,球迷看到德国7-1横扫库拉索，想理解为什么这支德国队同时具备机械精准和创意爆发两种气质——感觉像两种完全不同的能量同时存在。,分析整体阵容的星座元素分布解释7-1的统治性；重点：Musiala和Wirtz同为2003年生，土星落双子座——这一代人的集体特质是在压力下的语言与技术精准性，解释了两人为何能在高压比赛中保持创造力输出。团队层面以整体代际能量为核心，区别于第二篇的个人星盘拆解。,星盘页,,待写,/en/wiki/germany-2026-world-cup-team-astrology,,PG-TREND-003,worldcup_2026_astrology,Trend,Why Germany's 7-1 Win Makes Astrological Sense: Element Balance and a Saturn-in-Gemini Generation,N,,德国世界杯2026占星分析,Marcus Orion
vinicius jr birth chart astrology,"vinicius jr zodiac sign, vinicius cancer astrology, brazil world cup 2026 astrology, vinicius jr july 12",趋势词,0,Info,T2,Case Study,Cancer Sun / Jupiter in Taurus (2000年生) / Brazil Collective World Cup Wound,Vinicius进了一球巴西却只拿到平局——球迷困惑：为什么个人最强者无法带动整体？为什么巴西总在世界杯上让人失望？,巨蟹座（2000年7月12日生）的能量依赖整体情绪场的支撑，个人再强也无法单独承载集体的情感包袱。2000年出生的木星落金牛座赋予他天然的审美天赋和场上优雅感，但巨蟹座对家的执念在团队失调时会转化为内耗而非动力。注：无出生时间，仅做太阳星座分析。,星盘页,,待写,/en/wiki/vinicius-jr-birth-chart-cancer-astrology,,PG-TREND-004,worldcup_2026_astrology,Trend,Vinicius Jr's Cancer Sun and Brazil's World Cup Wound: Why Individual Brilliance Can't Carry a Collective,N,,维尼修斯星盘占星,Julian Thorne
scotland world cup 2026 astrology saturn return,"scotland saturn return football, scotland 28 year world cup absence astrology, scott mctominay birth chart, scotland world cup astrology",趋势词,0,Info,T2,Case Study,Saturn Return / 29.5-Year Cycle / Sagittarius Sun (McTominay 1996年12月2日),苏格兰球迷问：为什么偏偏是2026年？28年的等待结束，感觉像某种更大力量的安排，但说不清楚逻辑是什么。,土星公转周期约29.5年，苏格兰自1998年缺席世界杯至2026年恰好约等于一个完整土星周期——这是现代足球史上最精准的国家级土星回归案例。进球英雄Scott McTominay生于1996年12月2日（射手座），射手座的扩张性与跨越边界的冲动在土星回归的结构性节点爆发，象征意义极强。,星盘页,,待写,/en/wiki/scotland-world-cup-2026-saturn-return-astrology,,PG-TREND-005,worldcup_2026_astrology,Trend,Scotland's 28-Year Saturn Return: Why 2026 Was Always Written in the Stars,N,,苏格兰世界杯土星回归,Julian Thorne
